Sheet: Sheet1
B3: Level | C3: %long | D3: Wert f√ºr Upgrade
B4: 0 | C4: 0.5
B5: 1 | C5: of:=[.C4]+((1-[.C4])*0.1) -> 0.55 | D5: of:=ROUND((([.C5]/[.$C$4])-1)*100;0) -> 10
B6: 2 | C6: of:=[.C5]+((1-[.C5])*0.1) -> 0.595 | D6: of:=ROUND((([.C6]/[.$C$4])-1)*100;0) -> 19
B7: 3 | C7: of:=[.C6]+((1-[.C6])*0.1) -> 0.6355 | D7: of:=ROUND((([.C7]/[.$C$4])-1)*100;0) -> 27
B8: 4 | C8: of:=[.C7]+((1-[.C7])*0.1) -> 0.67195 | D8: of:=ROUND((([.C8]/[.$C$4])-1)*100;0) -> 34
B9: 5 | C9: of:=[.C8]+((1-[.C8])*0.1) -> 0.704755 | D9: of:=ROUND((([.C9]/[.$C$4])-1)*100;0) -> 41
B10: 6 | C10: of:=[.C9]+((1-[.C9])*0.1) -> 0.7342795 | D10: of:=ROUND((([.C10]/[.$C$4])-1)*100;0) -> 47
B11: 7 | C11: of:=[.C10]+((1-[.C10])*0.1) -> 0.76085155 | D11: of:=ROUND((([.C11]/[.$C$4])-1)*100;0) -> 52
B15: Initial hit chance/number of accuracy upgrades
B17: 40%/5: see Howitzer
B18: 70%/7: see Rocket Battery
B19: 80%/5: see Hurricane
B20: 95%/5: see Laser (special to not be unfair)
B21: 60%/5: see Cannon
B22: 30%/5: see CLuster Bomb
B23: 50%/5: see Grenade Launcher (structure)