Sheet: AAAvengerSAM
B2: ROF-Einheit: Schüsse pro Minute
D3: Soll | F3: Ist | H3: Zeile 0: absolut in 0,1 s, danach Abzüge in % | L3: Veränderungen in Upgrades immer in % des Ausgangswertes!!!!
B4: Update (0 = no update) | C4: numRounds | D4: Salvo | E4: Cycle | F4: Salvo | G4: Cycle | H4: firePause | I4: reloadTime | J4: firePauseΔ | K4: reloadTimeΔ
B5: 0 | C5: 2 | D5: of:=[.C5]*(60/(([.H5]*([.C5]-1))/10)) -> 240 | E5: of:=[.C5]*(60/((([.C5]-1)*[.H5]+[.I5])/10)) -> 11.4285714285714 | F5: of:=[.D5] -> 240 | G5: of:=[.E5] -> 11.4285714285714 | H5: 5 | I5: 100
B6: 1 | C6: 2 | D6: of:=ROUND([.D5]*1.1;0) -> 264 | E6: of:=[.E5]*1.1 -> 12.5714285714286 | F6: of:=[.C6]*(60/(([.H6]*([.C6]-1))/10)) -> 255.31914893617 | G6: of:=[.C6]*(60/((([.C6]-1)*[.H6]+[.I6])/10)) -> 12.5391849529781 | H6: 4.7 | I6: 91 | J6: of:=([.H6]-[.H5])/[.$H$5] -> -0.06 | K6: of:=([.I6]-[.I5])/[.$I$5] -> -0.09
B7: 2 | C7: 2 | D7: of:=ROUND([.D6]*1.1;0) -> 290 | E7: of:=[.E6]*1.1 -> 13.8285714285714 | F7: of:=[.C7]*(60/(([.H7]*([.C7]-1))/10)) -> 255.31914893617 | G7: of:=[.C7]*(60/((([.C7]-1)*[.H7]+[.I7])/10)) -> 13.840830449827 | H7: 4.7 | I7: 82 | J7: of:=([.H7]-[.H6])/[.$H$5] -> 0 | K7: of:=([.I7]-[.I6])/[.$I$5] -> -0.09
B8: 3 | C8: 2 | D8: of:=ROUND([.D7]*1.1;0) -> 319 | E8: of:=[.E7]*1.1 -> 15.2114285714286 | F8: of:=[.C8]*(60/(([.H8]*([.C8]-1))/10)) -> 300 | G8: of:=[.C8]*(60/((([.C8]-1)*[.H8]+[.I8])/10)) -> 15.1898734177215 | H8: 4 | I8: 75 | J8: of:=([.H8]-[.H7])/[.$H$5] -> -0.14 | K8: of:=([.I8]-[.I7])/[.$I$5] -> -0.07
B9: 4 | C9: 2 | D9: of:=ROUND([.D8]*1.1;0) -> 351 | E9: of:=[.E8]*1.1 -> 16.7325714285714 | F9: of:=[.C9]*(60/(([.H9]*([.C9]-1))/10)) -> 324.324324324324 | G9: of:=[.C9]*(60/((([.C9]-1)*[.H9]+[.I9])/10)) -> 16.7364016736402 | H9: 3.7 | I9: 68 | J9: of:=([.H9]-[.H8])/[.$H$5] -> -0.06 | K9: of:=([.I9]-[.I8])/[.$I$5] -> -0.07
B10: 5 | C10: 2 | D10: of:=ROUND([.D9]*1.1;0) -> 386 | E10: of:=[.E9]*1.1 -> 18.4058285714286 | F10: of:=[.C10]*(60/(([.H10]*([.C10]-1))/10)) -> 375 | G10: of:=[.C10]*(60/((([.C10]-1)*[.H10]+[.I10])/10)) -> 18.4049079754601 | H10: 3.2 | I10: 62 | J10: of:=([.H10]-[.H9])/[.$H$5] -> -0.1 | K10: of:=([.I10]-[.I9])/[.$I$5] -> -0.06
B11: 6 | C11: 2 | D11: of:=ROUND([.D10]*1.1;0) -> 425 | E11: of:=[.E10]*1.1 -> 20.2464114285714 | F11: of:=[.C11]*(60/(([.H11]*([.C11]-1))/10)) -> 375 | G11: of:=[.C11]*(60/((([.C11]-1)*[.H11]+[.I11])/10)) -> 20.2702702702703 | H11: 3.2 | I11: 56 | J11: of:=([.H11]-[.H10])/[.$H$5] -> 0 | K11: of:=([.I11]-[.I10])/[.$I$5] -> -0.06
B12: 7 | C12: 2 | D12: of:=ROUND([.D11]*1.1;0) -> 468 | E12: of:=[.E11]*1.1 -> 22.2710525714286 | F12: of:=[.C12]*(60/(([.H12]*([.C12]-1))/10)) -> 413.793103448276 | G12: of:=[.C12]*(60/((([.C12]-1)*[.H12]+[.I12])/10)) -> 22.2634508348794 | H12: 2.9 | I12: 51 | J12: of:=([.H12]-[.H11])/[.$H$5] -> -0.0600000000000001 | K12: of:=([.I12]-[.I11])/[.$I$5] -> -0.05
E15: 0
E16: 2 51 208
E17: 3 01 749 | F17: 10,54 s | G17: of:=2*60/10.54 -> 11.3851992409867
E19: 1
E20: 16 50 912
E21: 17 00 408 | F21: 9,494 s | G21: of:=2*60/9.494 -> 12.6395618285233
E23: 2
E24: 24 15 312
E25: 24 23 908 | F25: 8,594 s | G25: of:=2*60/8.594 -> 13.9632301605771

Sheet: AACyclone
B2: ROF-Einheit: Schüsse pro Minute
D3: Soll | F3: Ist | H3: Zeile 0: absolut in 0,1 s, danach Abzüge in % | L3: Veränderungen in Upgrades immer in % des Ausgangswertes!!!!
B4: Update (0 = no update) | C4: numRounds | D4: Salvo | E4: Cycle | F4: Salvo | G4: Cycle | H4: firePause | I4: reloadTime | J4: firePauseΔ | K4: reloadTimeΔ
B5: 0 | C5: 2 | D5: of:=[.C5]*(60/(([.H5]*([.C5]-1))/10)) -> 120 | E5: of:=[.C5]*(60/((([.C5]-1)*[.H5]+[.I5])/10)) -> 5.71428571428571 | F5: of:=[.D5] -> 120 | G5: of:=[.E5] -> 5.71428571428571 | H5: 10 | I5: 200
B6: 1 | C6: 2 | D6: of:=ROUND([.D5]*1.1;0) -> 132 | E6: of:=[.E5]*1.1 -> 6.28571428571429 | F6: of:=[.C6]*(60/(([.H6]*([.C6]-1))/10)) -> 131.868131868132 | G6: of:=[.C6]*(60/((([.C6]-1)*[.H6]+[.I6])/10)) -> 6.27943485086342 | H6: 9.1 | I6: 182 | J6: of:=([.H6]-[.H5])/[.$H$5] -> -0.09 | K6: of:=([.I6]-[.I5])/[.$I$5] -> -0.09
B7: 2 | C7: 2 | D7: of:=ROUND([.D6]*1.1;0) -> 145 | E7: of:=[.E6]*1.1 -> 6.91428571428572 | F7: of:=[.C7]*(60/(([.H7]*([.C7]-1))/10)) -> 144.578313253012 | G7: of:=[.C7]*(60/((([.C7]-1)*[.H7]+[.I7])/10)) -> 6.92440854010387 | H7: 8.3 | I7: 165 | J7: of:=([.H7]-[.H6])/[.$H$5] -> -0.0799999999999999 | K7: of:=([.I7]-[.I6])/[.$I$5] -> -0.085
B8: 3 | C8: 2 | D8: of:=ROUND([.D7]*1.1;0) -> 160 | E8: of:=[.E7]*1.1 -> 7.60571428571429 | F8: of:=[.C8]*(60/(([.H8]*([.C8]-1))/10)) -> 160 | G8: of:=[.C8]*(60/((([.C8]-1)*[.H8]+[.I8])/10)) -> 7.66773162939297 | H8: 7.5 | I8: 149 | J8: of:=([.H8]-[.H7])/[.$H$5] -> -0.0800000000000001 | K8: of:=([.I8]-[.I7])/[.$I$5] -> -0.08
B9: 4 | C9: 2 | D9: of:=ROUND([.D8]*1.1;0) -> 176 | E9: of:=[.E8]*1.1 -> 8.36628571428572 | F9: of:=[.C9]*(60/(([.H9]*([.C9]-1))/10)) -> 176.470588235294 | G9: of:=[.C9]*(60/((([.C9]-1)*[.H9]+[.I9])/10)) -> 8.40336134453781 | H9: 6.8 | I9: 136 | J9: of:=([.H9]-[.H8])/[.$H$5] -> -0.07 | K9: of:=([.I9]-[.I8])/[.$I$5] -> -0.065
B10: 5 | C10: 2 | D10: of:=ROUND([.D9]*1.1;0) -> 194 | E10: of:=[.E9]*1.1 -> 9.20291428571429 | F10: of:=[.C10]*(60/(([.H10]*([.C10]-1))/10)) -> 193.548387096774 | G10: of:=[.C10]*(60/((([.C10]-1)*[.H10]+[.I10])/10)) -> 9.14634146341463 | H10: 6.2 | I10: 125 | J10: of:=([.H10]-[.H9])/[.$H$5] -> -0.06 | K10: of:=([.I10]-[.I9])/[.$I$5] -> -0.055
B11: 6 | C11: 2 | D11: of:=ROUND([.D10]*1.1;0) -> 213 | E11: of:=[.E10]*1.1 -> 10.1232057142857 | F11: of:=[.C11]*(60/(([.H11]*([.C11]-1))/10)) -> 214.285714285714 | G11: of:=[.C11]*(60/((([.C11]-1)*[.H11]+[.I11])/10)) -> 10.1180438448567 | H11: 5.6 | I11: 113 | J11: of:=([.H11]-[.H10])/[.$H$5] -> -0.0600000000000001 | K11: of:=([.I11]-[.I10])/[.$I$5] -> -0.06
B12: 7 | C12: 2 | D12: of:=ROUND([.D11]*1.1;0) -> 234 | E12: of:=[.E11]*1.1 -> 11.1355262857143 | F12: of:=[.C12]*(60/(([.H12]*([.C12]-1))/10)) -> 235.294117647059 | G12: of:=[.C12]*(60/((([.C12]-1)*[.H12]+[.I12])/10)) -> 11.1008325624422 | H12: 5.1 | I12: 103 | J12: of:=([.H12]-[.H11])/[.$H$5] -> -0.05 | K12: of:=([.I12]-[.I11])/[.$I$5] -> -0.05

Sheet: AAHurricane
B2: ROF-Einheit: Schüsse pro Minute
D3: Soll | F3: Ist | H3: Zeile 0: absolut in 0,1 s, danach Abzüge in % | L3: Veränderungen in Upgrades immer in % des Ausgangswertes!!!!
B4: Update (0 = no update) | C4: numRounds | D4: Salvo | E4: Cycle | F4: Salvo | G4: Cycle | H4: firePause | I4: reloadTime | J4: firePauseΔ | K4: reloadTimeΔ
B5: 0 | C5: 4 | D5: of:=[.C5]*(60/(([.H5]*([.C5]-1))/10)) -> 800 | E5: of:=[.C5]*(60/((([.C5]-1)*[.H5]+[.I5])/10)) -> 72.7272727272727 | F5: of:=[.D5] -> 800 | G5: of:=[.E5] -> 72.7272727272727 | H5: 1 | I5: 30
B6: 1 | C6: 4 | D6: of:=ROUND([.D5]*1.1;0) -> 880 | E6: of:=[.E5]*1.1 -> 80 | F6: of:=[.C6]*(60/(([.H6]*([.C6]-1))/10)) -> 888.888888888889 | G6: of:=[.C6]*(60/((([.C6]-1)*[.H6]+[.I6])/10)) -> 80.8080808080808 | H6: 0.9 | I6: 27 | J6: of:=([.H6]-[.H5])/[.$H$5] -> -0.1 | K6: of:=([.I6]-[.I5])/[.$I$5] -> -0.1
B7: 2 | C7: 4 | D7: of:=ROUND([.D6]*1.1;0) -> 968 | E7: of:=[.E6]*1.1 -> 88 | F7: of:=[.C7]*(60/(([.H7]*([.C7]-1))/10)) -> 963.855421686747 | G7: of:=[.C7]*(60/((([.C7]-1)*[.H7]+[.I7])/10)) -> 87.3044743543107 | H7: 0.83 | I7: 25 | J7: of:=([.H7]-[.H6])/[.$H$5] -> -0.07 | K7: of:=([.I7]-[.I6])/[.$I$5] -> -0.0666666666666667
B8: 3 | C8: 4 | D8: of:=ROUND([.D7]*1.1;0) -> 1065 | E8: of:=[.E7]*1.1 -> 96.8 | F8: of:=[.C8]*(60/(([.H8]*([.C8]-1))/10)) -> 1066.66666666667 | G8: of:=[.C8]*(60/((([.C8]-1)*[.H8]+[.I8])/10)) -> 95.049504950495 | H8: 0.75 | I8: 23 | J8: of:=([.H8]-[.H7])/[.$H$5] -> -0.0800000000000001 | K8: of:=([.I8]-[.I7])/[.$I$5] -> -0.0666666666666667
B9: 4 | C9: 4 | D9: of:=ROUND([.D8]*1.1;0) -> 1172 | E9: of:=[.E8]*1.1 -> 106.48 | F9: of:=[.C9]*(60/(([.H9]*([.C9]-1))/10)) -> 1176.47058823529 | G9: of:=[.C9]*(60/((([.C9]-1)*[.H9]+[.I9])/10)) -> 104.166666666667 | H9: 0.68 | I9: 21 | J9: of:=([.H9]-[.H8])/[.$H$5] -> -0.07 | K9: of:=([.I9]-[.I8])/[.$I$5] -> -0.0666666666666667
B10: 5 | C10: 4 | D10: of:=ROUND([.D9]*1.1;0) -> 1289 | E10: of:=[.E9]*1.1 -> 117.128 | F10: of:=[.C10]*(60/(([.H10]*([.C10]-1))/10)) -> 1290.32258064516 | G10: of:=[.C10]*(60/((([.C10]-1)*[.H10]+[.I10])/10)) -> 115.052732502397 | H10: 0.62 | I10: 19 | J10: of:=([.H10]-[.H9])/[.$H$5] -> -0.0600000000000001 | K10: of:=([.I10]-[.I9])/[.$I$5] -> -0.0666666666666667
B11: 6 | C11: 4 | D11: of:=ROUND([.D10]*1.1;0) -> 1418 | E11: of:=[.E10]*1.1 -> 128.8408 | F11: of:=[.C11]*(60/(([.H11]*([.C11]-1))/10)) -> 1403.50877192982 | G11: of:=[.C11]*(60/((([.C11]-1)*[.H11]+[.I11])/10)) -> 128.273650454303 | H11: 0.57 | I11: 17 | J11: of:=([.H11]-[.H10])/[.$H$5] -> -0.0499999999999999 | K11: of:=([.I11]-[.I10])/[.$I$5] -> -0.0666666666666667
B12: 7 | C12: 4 | D12: of:=ROUND([.D11]*1.1;0) -> 1560 | E12: of:=[.E11]*1.1 -> 141.72488 | F12: of:=[.C12]*(60/(([.H12]*([.C12]-1))/10)) -> 1538.46153846154 | G12: of:=[.C12]*(60/((([.C12]-1)*[.H12]+[.I12])/10)) -> 144.927536231884 | H12: 0.52 | I12: 15 | J12: of:=([.H12]-[.H11])/[.$H$5] -> -0.05 | K12: of:=([.I12]-[.I11])/[.$I$5] -> -0.0666666666666667

Sheet: AAStormbringer
B2: ROF-Einheit: Schüsse pro Minute
D3: Soll | F3: Ist | H3: Zeile 0: absolut in 0,1 s, danach Abzüge in % | L3: Veränderungen in Upgrades immer in % des Ausgangswertes!!!!
B4: Update (0 = no update) | C4: numRounds | D4: Salvo | E4: Cycle | F4: Salvo | G4: Cycle | H4: firePause | I4: reloadTime | J4: firePauseΔ | K4: reloadTimeΔ
B5: 0 | C5: 1 | D5: of:=[.C5]*(60/(([.H5]*([.C5]-1))/10)) ->  | E5: of:=[.C5]*(60/((([.C5]-1)*[.I5]+[.I5])/10)) -> 6 | F5: of:=[.D5] ->  | G5: of:=[.E5] -> 6 | I5: 100
B6: 1 | C6: 1 | D6: of:=ROUND([.D5]*1.1;0) ->  | E6: of:=[.E5]*1.1 -> 6.6 | F6: of:=[.C6]*(60/(([.H6]*([.C6]-1))/10)) ->  | G6: of:=[.C6]*(60/((([.C6]-1)*[.I6]+[.I6])/10)) -> 6.59340659340659 | I6: 91 | J6: of:=([.H6]-[.H5])/[.$H$5] ->  | K6: of:=([.I6]-[.I5])/[.$I$5] -> -0.09
B7: 2 | C7: 1 | D7: of:=ROUND([.D6]*1.1;0) ->  | E7: of:=[.E6]*1.1 -> 7.26 | F7: of:=[.C7]*(60/(([.H7]*([.C7]-1))/10)) ->  | G7: of:=[.C7]*(60/((([.C7]-1)*[.I7]+[.I7])/10)) -> 7.31707317073171 | I7: 82 | J7: of:=([.H7]-[.H6])/[.$H$5] ->  | K7: of:=([.I7]-[.I6])/[.$I$5] -> -0.09
B8: 3 | C8: 1 | D8: of:=ROUND([.D7]*1.1;0) ->  | E8: of:=[.E7]*1.1 -> 7.986 | F8: of:=[.C8]*(60/(([.H8]*([.C8]-1))/10)) ->  | G8: of:=[.C8]*(60/((([.C8]-1)*[.I8]+[.I8])/10)) -> 8 | I8: 75 | J8: of:=([.H8]-[.H7])/[.$H$5] ->  | K8: of:=([.I8]-[.I7])/[.$I$5] -> -0.07
B9: 4 | C9: 1 | D9: of:=ROUND([.D8]*1.1;0) ->  | E9: of:=[.E8]*1.1 -> 8.7846 | F9: of:=[.C9]*(60/(([.H9]*([.C9]-1))/10)) ->  | G9: of:=[.C9]*(60/((([.C9]-1)*[.I9]+[.I9])/10)) -> 8.82352941176471 | I9: 68 | J9: of:=([.H9]-[.H8])/[.$H$5] ->  | K9: of:=([.I9]-[.I8])/[.$I$5] -> -0.07
B10: 5 | C10: 1 | D10: of:=ROUND([.D9]*1.1;0) ->  | E10: of:=[.E9]*1.1 -> 9.66306 | F10: of:=[.C10]*(60/(([.H10]*([.C10]-1))/10)) ->  | G10: of:=[.C10]*(60/((([.C10]-1)*[.I10]+[.I10])/10)) -> 9.67741935483871 | I10: 62 | J10: of:=([.H10]-[.H9])/[.$H$5] ->  | K10: of:=([.I10]-[.I9])/[.$I$5] -> -0.06
B11: 6 | C11: 1 | D11: of:=ROUND([.D10]*1.1;0) ->  | E11: of:=[.E10]*1.1 -> 10.629366 | F11: of:=[.C11]*(60/(([.H11]*([.C11]-1))/10)) ->  | G11: of:=[.C11]*(60/((([.C11]-1)*[.I11]+[.I11])/10)) -> 10.7142857142857 | I11: 56 | J11: of:=([.H11]-[.H10])/[.$H$5] ->  | K11: of:=([.I11]-[.I10])/[.$I$5] -> -0.06
B12: 7 | C12: 1 | D12: of:=ROUND([.D11]*1.1;0) ->  | E12: of:=[.E11]*1.1 -> 11.6923026 | F12: of:=[.C12]*(60/(([.H12]*([.C12]-1))/10)) ->  | G12: of:=[.C12]*(60/((([.C12]-1)*[.I12]+[.I12])/10)) -> 11.7647058823529 | I12: 51 | J12: of:=([.H12]-[.H11])/[.$H$5] ->  | K12: of:=([.I12]-[.I11])/[.$I$5] -> -0.05

Sheet: Autocannon-Tank
B2: ROF-Einheit: Schüsse pro Minute
D3: Soll | F3: Ist | H3: Zeile 0: absolut in 0,1 s, danach Abzüge in % | L3: Veränderungen in Upgrades immer in % des Ausgangswertes!!!!
B4: Update (0 = no update) | C4: numRounds | D4: Salvo | E4: Cycle | F4: Salvo | G4: Cycle | H4: firePause | I4: reloadTime | J4: firePauseΔ | K4: reloadTimeΔ
B5: 0 | C5: 5 | D5: of:=[.C5]*(60/(([.H5]*([.C5]-1))/10)) -> 75 | E5: of:=[.C5]*(60/((([.C5]-1)*[.I5]+[.I5])/10)) -> 7.5 | F5: of:=[.D5] -> 75 | G5: of:=[.E5] -> 7.5 | H5: 10 | I5: 80
B6: 1 | C6: 5 | D6: of:=ROUND([.D5]*1.1;0) -> 83 | E6: of:=[.E5]*1.1 -> 8.25 | F6: of:=[.C6]*(60/(([.H6]*([.C6]-1))/10)) -> 82.4175824175824 | G6: of:=[.C6]*(60/((([.C6]-1)*[.I6]+[.I6])/10)) -> 8.21917808219178 | H6: 9.1 | I6: 73 | J6: of:=([.H6]-[.H5])/[.$H$5] -> -0.09 | K6: of:=([.I6]-[.I5])/[.$I$5] -> -0.0875
B7: 2 | C7: 5 | D7: of:=ROUND([.D6]*1.1;0) -> 91 | E7: of:=[.E6]*1.1 -> 9.075 | F7: of:=[.C7]*(60/(([.H7]*([.C7]-1))/10)) -> 90.3614457831325 | G7: of:=[.C7]*(60/((([.C7]-1)*[.I7]+[.I7])/10)) -> 9.09090909090909 | H7: 8.3 | I7: 66 | J7: of:=([.H7]-[.H6])/[.$H$5] -> -0.0799999999999999 | K7: of:=([.I7]-[.I6])/[.$I$5] -> -0.0875
B8: 3 | C8: 5 | D8: of:=ROUND([.D7]*1.1;0) -> 100 | E8: of:=[.E7]*1.1 -> 9.9825 | F8: of:=[.C8]*(60/(([.H8]*([.C8]-1))/10)) -> 101.351351351351 | G8: of:=[.C8]*(60/((([.C8]-1)*[.I8]+[.I8])/10)) -> 10 | H8: 7.4 | I8: 60 | J8: of:=([.H8]-[.H7])/[.$H$5] -> -0.09 | K8: of:=([.I8]-[.I7])/[.$I$5] -> -0.075
B9: 4 | C9: 5 | D9: of:=ROUND([.D8]*1.1;0) -> 110 | E9: of:=[.E8]*1.1 -> 10.98075 | F9: of:=[.C9]*(60/(([.H9]*([.C9]-1))/10)) -> 110.294117647059 | G9: of:=[.C9]*(60/((([.C9]-1)*[.I9]+[.I9])/10)) -> 10.9090909090909 | H9: 6.8 | I9: 55 | J9: of:=([.H9]-[.H8])/[.$H$5] -> -0.0600000000000001 | K9: of:=([.I9]-[.I8])/[.$I$5] -> -0.0625
B10: 5 | C10: 5 | D10: of:=ROUND([.D9]*1.1;0) -> 121 | E10: of:=[.E9]*1.1 -> 12.078825 | F10: of:=[.C10]*(60/(([.H10]*([.C10]-1))/10)) -> 120.967741935484 | G10: of:=[.C10]*(60/((([.C10]-1)*[.I10]+[.I10])/10)) -> 12 | H10: 6.2 | I10: 50 | J10: of:=([.H10]-[.H9])/[.$H$5] -> -0.06 | K10: of:=([.I10]-[.I9])/[.$I$5] -> -0.0625
B11: 6 | C11: 5 | D11: of:=ROUND([.D10]*1.1;0) -> 133 | E11: of:=[.E10]*1.1 -> 13.2867075 | F11: of:=[.C11]*(60/(([.H11]*([.C11]-1))/10)) -> 131.578947368421 | G11: of:=[.C11]*(60/((([.C11]-1)*[.I11]+[.I11])/10)) -> 13.3333333333333 | H11: 5.7 | I11: 45 | J11: of:=([.H11]-[.H10])/[.$H$5] -> -0.05 | K11: of:=([.I11]-[.I10])/[.$I$5] -> -0.0625
B12: 7 | C12: 5 | D12: of:=ROUND([.D11]*1.1;0) -> 146 | E12: of:=[.E11]*1.1 -> 14.61537825 | F12: of:=[.C12]*(60/(([.H12]*([.C12]-1))/10)) -> 147.058823529412 | G12: of:=[.C12]*(60/((([.C12]-1)*[.I12]+[.I12])/10)) -> 14.6341463414634 | H12: 5.1 | I12: 41 | J12: of:=([.H12]-[.H11])/[.$H$5] -> -0.0600000000000001 | K12: of:=([.I12]-[.I11])/[.$I$5] -> -0.05

Sheet: BombCluster
B2: ROF-Einheit: Schüsse pro Minute
D3: Soll | F3: Ist | H3: Zeile 0: absolut in 0,1 s, danach Abzüge in % | L3: Veränderungen in Upgrades immer in % des Ausgangswertes!!!!
B4: Update (0 = no update) | C4: numRounds | D4: Salvo | E4: Cycle | F4: Salvo | G4: Cycle | H4: firePause | I4: reloadTime | J4: firePauseΔ | K4: reloadTimeΔ
B5: 0 | C5: 5 | D5: of:=[.C5]*(60/(([.H5]*([.C5]-1))/10)) -> 750 | E5: of:=[.C5]*(60/((([.C5]-1)*[.I5]+[.I5])/10)) -> 12 | F5: of:=[.D5] -> 750 | G5: of:=[.E5] -> 12 | H5: 1 | I5: 50
B6: 1 | C6: 5 | D6: of:=ROUND([.D5]*1.1;0) -> 825 | E6: of:=[.E5]*1.1 -> 13.2 | F6: of:=[.C6]*(60/(([.H6]*([.C6]-1))/10)) -> 824.175824175824 | G6: of:=[.C6]*(60/((([.C6]-1)*[.I6]+[.I6])/10)) -> 13.0434782608696 | H6: 0.91 | I6: 46 | J6: of:=([.H6]-[.H5])/[.$H$5] -> -0.09 | K6: of:=([.I6]-[.I5])/[.$I$5] -> -0.08
B7: 2 | C7: 5 | D7: of:=ROUND([.D6]*1.1;0) -> 908 | E7: of:=[.E6]*1.1 -> 14.52 | F7: of:=[.C7]*(60/(([.H7]*([.C7]-1))/10)) -> 903.614457831325 | G7: of:=[.C7]*(60/((([.C7]-1)*[.I7]+[.I7])/10)) -> 14.6341463414634 | H7: 0.83 | I7: 41 | J7: of:=([.H7]-[.H6])/[.$H$5] -> -0.08 | K7: of:=([.I7]-[.I6])/[.$I$5] -> -0.1
B8: 3 | C8: 5 | D8: of:=ROUND([.D7]*1.1;0) -> 999 | E8: of:=[.E7]*1.1 -> 15.972 | F8: of:=[.C8]*(60/(([.H8]*([.C8]-1))/10)) -> 1000 | G8: of:=[.C8]*(60/((([.C8]-1)*[.I8]+[.I8])/10)) -> 15.7894736842105 | H8: 0.75 | I8: 38 | J8: of:=([.H8]-[.H7])/[.$H$5] -> -0.0800000000000001 | K8: of:=([.I8]-[.I7])/[.$I$5] -> -0.06
B9: 4 | C9: 5 | D9: of:=ROUND([.D8]*1.1;0) -> 1099 | E9: of:=[.E8]*1.1 -> 17.5692 | F9: of:=[.C9]*(60/(([.H9]*([.C9]-1))/10)) -> 1102.94117647059 | G9: of:=[.C9]*(60/((([.C9]-1)*[.I9]+[.I9])/10)) -> 17.6470588235294 | H9: 0.68 | I9: 34 | J9: of:=([.H9]-[.H8])/[.$H$5] -> -0.07 | K9: of:=([.I9]-[.I8])/[.$I$5] -> -0.08
B10: 5 | C10: 5 | D10: of:=ROUND([.D9]*1.1;0) -> 1209 | E10: of:=[.E9]*1.1 -> 19.32612 | F10: of:=[.C10]*(60/(([.H10]*([.C10]-1))/10)) -> 1209.67741935484 | G10: of:=[.C10]*(60/((([.C10]-1)*[.I10]+[.I10])/10)) -> 19.3548387096774 | H10: 0.62 | I10: 31 | J10: of:=([.H10]-[.H9])/[.$H$5] -> -0.0600000000000001 | K10: of:=([.I10]-[.I9])/[.$I$5] -> -0.06
B11: 6 | C11: 5 | D11: of:=ROUND([.D10]*1.1;0) -> 1330 | E11: of:=[.E10]*1.1 -> 21.258732 | F11: of:=[.C11]*(60/(([.H11]*([.C11]-1))/10)) -> 1315.78947368421 | G11: of:=[.C11]*(60/((([.C11]-1)*[.I11]+[.I11])/10)) -> 21.4285714285714 | H11: 0.57 | I11: 28 | J11: of:=([.H11]-[.H10])/[.$H$5] -> -0.0499999999999999 | K11: of:=([.I11]-[.I10])/[.$I$5] -> -0.06
B12: 7 | C12: 5 | D12: of:=ROUND([.D11]*1.1;0) -> 1463 | E12: of:=[.E11]*1.1 -> 23.3846052 | F12: of:=[.C12]*(60/(([.H12]*([.C12]-1))/10)) -> 1470.58823529412 | G12: of:=[.C12]*(60/((([.C12]-1)*[.I12]+[.I12])/10)) -> 23.0769230769231 | H12: 0.51 | I12: 26 | J12: of:=([.H12]-[.H11])/[.$H$5] -> -0.0600000000000001 | K12: of:=([.I12]-[.I11])/[.$I$5] -> -0.04

Sheet: BombHeavy
B2: ROF-Einheit: Schüsse pro Minute
D3: Soll | F3: Ist | H3: Zeile 0: absolut in 0,1 s, danach Abzüge in % | L3: Veränderungen in Upgrades immer in % des Ausgangswertes!!!!
B4: Update (0 = no update) | C4: numRounds | D4: Salvo | E4: Cycle | F4: Salvo | G4: Cycle | H4: firePause | I4: reloadTime | J4: firePauseΔ | K4: reloadTimeΔ
B5: 0 | C5: 1 | D5: of:=[.C5]*(60/(([.H5]*([.C5]-1))/10)) ->  | E5: of:=[.C5]*(60/((([.C5]-1)*[.I5]+[.I5])/10)) -> 12 | F5: of:=[.D5] ->  | G5: of:=[.E5] -> 12 | I5: 50
B6: 1 | C6: 1 | D6: of:=ROUND([.D5]*1.1;0) ->  | E6: of:=[.E5]*1.1 -> 13.2 | F6: of:=[.C6]*(60/(([.H6]*([.C6]-1))/10)) ->  | G6: of:=[.C6]*(60/((([.C6]-1)*[.I6]+[.I6])/10)) -> 13.0434782608696 | I6: 46 | J6: of:=([.H6]-[.H5])/[.$H$5] ->  | K6: of:=([.I6]-[.I5])/[.$I$5] -> -0.08
B7: 2 | C7: 1 | D7: of:=ROUND([.D6]*1.1;0) ->  | E7: of:=[.E6]*1.1 -> 14.52 | F7: of:=[.C7]*(60/(([.H7]*([.C7]-1))/10)) ->  | G7: of:=[.C7]*(60/((([.C7]-1)*[.I7]+[.I7])/10)) -> 14.2857142857143 | I7: 42 | J7: of:=([.H7]-[.H6])/[.$H$5] ->  | K7: of:=([.I7]-[.I6])/[.$I$5] -> -0.08
B8: 3 | C8: 1 | D8: of:=ROUND([.D7]*1.1;0) ->  | E8: of:=[.E7]*1.1 -> 15.972 | F8: of:=[.C8]*(60/(([.H8]*([.C8]-1))/10)) ->  | G8: of:=[.C8]*(60/((([.C8]-1)*[.I8]+[.I8])/10)) -> 15.7894736842105 | I8: 38 | J8: of:=([.H8]-[.H7])/[.$H$5] ->  | K8: of:=([.I8]-[.I7])/[.$I$5] -> -0.08
B9: 4 | C9: 1 | D9: of:=ROUND([.D8]*1.1;0) ->  | E9: of:=[.E8]*1.1 -> 17.5692 | F9: of:=[.C9]*(60/(([.H9]*([.C9]-1))/10)) ->  | G9: of:=[.C9]*(60/((([.C9]-1)*[.I9]+[.I9])/10)) -> 17.6470588235294 | I9: 34 | J9: of:=([.H9]-[.H8])/[.$H$5] ->  | K9: of:=([.I9]-[.I8])/[.$I$5] -> -0.08
B10: 5 | C10: 1 | D10: of:=ROUND([.D9]*1.1;0) ->  | E10: of:=[.E9]*1.1 -> 19.32612 | F10: of:=[.C10]*(60/(([.H10]*([.C10]-1))/10)) ->  | G10: of:=[.C10]*(60/((([.C10]-1)*[.I10]+[.I10])/10)) -> 19.3548387096774 | I10: 31 | J10: of:=([.H10]-[.H9])/[.$H$5] ->  | K10: of:=([.I10]-[.I9])/[.$I$5] -> -0.06
B11: 6 | C11: 1 | D11: of:=ROUND([.D10]*1.1;0) ->  | E11: of:=[.E10]*1.1 -> 21.258732 | F11: of:=[.C11]*(60/(([.H11]*([.C11]-1))/10)) ->  | G11: of:=[.C11]*(60/((([.C11]-1)*[.I11]+[.I11])/10)) -> 21.4285714285714 | I11: 28 | J11: of:=([.H11]-[.H10])/[.$H$5] ->  | K11: of:=([.I11]-[.I10])/[.$I$5] -> -0.06
B12: 7 | C12: 1 | D12: of:=ROUND([.D11]*1.1;0) ->  | E12: of:=[.E11]*1.1 -> 23.3846052 | F12: of:=[.C12]*(60/(([.H12]*([.C12]-1))/10)) ->  | G12: of:=[.C12]*(60/((([.C12]-1)*[.I12]+[.I12])/10)) -> 23.0769230769231 | I12: 26 | J12: of:=([.H12]-[.H11])/[.$H$5] ->  | K12: of:=([.I12]-[.I11])/[.$I$5] -> -0.04

Sheet: BombThermite
B2: ROF-Einheit: Schüsse pro Minute
D3: Soll | F3: Ist | H3: Zeile 0: absolut in 0,1 s, danach Abzüge in % | L3: Veränderungen in Upgrades immer in % des Ausgangswertes!!!!
B4: Update (0 = no update) | C4: numRounds | D4: Salvo | E4: Cycle | F4: Salvo | G4: Cycle | H4: firePause | I4: reloadTime | J4: firePauseΔ | K4: reloadTimeΔ
B5: 0 | C5: 1 | D5: of:=[.C5]*(60/(([.H5]*([.C5]-1))/10)) ->  | E5: of:=[.C5]*(60/((([.C5]-1)*[.I5]+[.I5])/10)) -> 12 | F5: of:=[.D5] ->  | G5: of:=[.E5] -> 12 | I5: 50
B6: 1 | C6: 1 | D6: of:=ROUND([.D5]*1.1;0) ->  | E6: of:=[.E5]*1.1 -> 13.2 | F6: of:=[.C6]*(60/(([.H6]*([.C6]-1))/10)) ->  | G6: of:=[.C6]*(60/((([.C6]-1)*[.I6]+[.I6])/10)) -> 13.0434782608696 | I6: 46 | J6: of:=([.H6]-[.H5])/[.$H$5] ->  | K6: of:=([.I6]-[.I5])/[.$I$5] -> -0.08
B7: 2 | C7: 1 | D7: of:=ROUND([.D6]*1.1;0) ->  | E7: of:=[.E6]*1.1 -> 14.52 | F7: of:=[.C7]*(60/(([.H7]*([.C7]-1))/10)) ->  | G7: of:=[.C7]*(60/((([.C7]-1)*[.I7]+[.I7])/10)) -> 14.2857142857143 | I7: 42 | J7: of:=([.H7]-[.H6])/[.$H$5] ->  | K7: of:=([.I7]-[.I6])/[.$I$5] -> -0.08
B8: 3 | C8: 1 | D8: of:=ROUND([.D7]*1.1;0) ->  | E8: of:=[.E7]*1.1 -> 15.972 | F8: of:=[.C8]*(60/(([.H8]*([.C8]-1))/10)) ->  | G8: of:=[.C8]*(60/((([.C8]-1)*[.I8]+[.I8])/10)) -> 15.7894736842105 | I8: 38 | J8: of:=([.H8]-[.H7])/[.$H$5] ->  | K8: of:=([.I8]-[.I7])/[.$I$5] -> -0.08
B9: 4 | C9: 1 | D9: of:=ROUND([.D8]*1.1;0) ->  | E9: of:=[.E8]*1.1 -> 17.5692 | F9: of:=[.C9]*(60/(([.H9]*([.C9]-1))/10)) ->  | G9: of:=[.C9]*(60/((([.C9]-1)*[.I9]+[.I9])/10)) -> 17.6470588235294 | I9: 34 | J9: of:=([.H9]-[.H8])/[.$H$5] ->  | K9: of:=([.I9]-[.I8])/[.$I$5] -> -0.08
B10: 5 | C10: 1 | D10: of:=ROUND([.D9]*1.1;0) ->  | E10: of:=[.E9]*1.1 -> 19.32612 | F10: of:=[.C10]*(60/(([.H10]*([.C10]-1))/10)) ->  | G10: of:=[.C10]*(60/((([.C10]-1)*[.I10]+[.I10])/10)) -> 19.3548387096774 | I10: 31 | J10: of:=([.H10]-[.H9])/[.$H$5] ->  | K10: of:=([.I10]-[.I9])/[.$I$5] -> -0.06
B11: 6 | C11: 1 | D11: of:=ROUND([.D10]*1.1;0) ->  | E11: of:=[.E10]*1.1 -> 21.258732 | F11: of:=[.C11]*(60/(([.H11]*([.C11]-1))/10)) ->  | G11: of:=[.C11]*(60/((([.C11]-1)*[.I11]+[.I11])/10)) -> 21.4285714285714 | I11: 28 | J11: of:=([.H11]-[.H10])/[.$H$5] ->  | K11: of:=([.I11]-[.I10])/[.$I$5] -> -0.06
B12: 7 | C12: 1 | D12: of:=ROUND([.D11]*1.1;0) ->  | E12: of:=[.E11]*1.1 -> 23.3846052 | F12: of:=[.C12]*(60/(([.H12]*([.C12]-1))/10)) ->  | G12: of:=[.C12]*(60/((([.C12]-1)*[.I12]+[.I12])/10)) -> 23.0769230769231 | I12: 26 | J12: of:=([.H12]-[.H11])/[.$H$5] ->  | K12: of:=([.I12]-[.I11])/[.$I$5] -> -0.04

Sheet: Cannon-Cyborg
B2: ROF-Einheit: Schüsse pro Minute
D3: Soll | F3: Ist | H3: Zeile 0: absolut in 0,1 s, danach Abzüge in % | L3: Veränderungen in Upgrades immer in % des Ausgangswertes!!!!
B4: Update (0 = no update) | C4: numRounds | D4: Salvo | E4: Cycle | F4: Salvo | G4: Cycle | H4: firePause | I4: reloadTime | J4: firePauseΔ | K4: reloadTimeΔ
B5: 0 | C5: 1 | D5: of:=[.C5]*(60/(([.H5]*([.C5]-1))/10)) ->  | E5: of:=[.C5]*(60/((([.C5]-1)*[.I5]+[.I5])/10)) -> 4.61538461538462 | F5: of:=[.D5] ->  | G5: of:=[.E5] -> 4.61538461538462 | I5: 130
B6: 1 | C6: 1 | D6: of:=ROUND([.D5]*1.1;0) ->  | E6: of:=[.E5]*1.1 -> 5.07692307692308 | F6: of:=[.C6]*(60/(([.H6]*([.C6]-1))/10)) ->  | G6: of:=[.C6]*(60/((([.C6]-1)*[.I6]+[.I6])/10)) -> 5.08474576271186 | I6: 118 | J6: of:=([.H6]-[.H5])/[.$H$5] ->  | K6: of:=([.I6]-[.I5])/[.$I$5] -> -0.0923076923076923
B7: 2 | C7: 1 | D7: of:=ROUND([.D6]*1.1;0) ->  | E7: of:=[.E6]*1.1 -> 5.58461538461539 | F7: of:=[.C7]*(60/(([.H7]*([.C7]-1))/10)) ->  | G7: of:=[.C7]*(60/((([.C7]-1)*[.I7]+[.I7])/10)) -> 5.55555555555556 | I7: 108 | J7: of:=([.H7]-[.H6])/[.$H$5] ->  | K7: of:=([.I7]-[.I6])/[.$I$5] -> -0.0769230769230769
B8: 3 | C8: 1 | D8: of:=ROUND([.D7]*1.1;0) ->  | E8: of:=[.E7]*1.1 -> 6.14307692307692 | F8: of:=[.C8]*(60/(([.H8]*([.C8]-1))/10)) ->  | G8: of:=[.C8]*(60/((([.C8]-1)*[.I8]+[.I8])/10)) -> 6.12244897959184 | I8: 98 | J8: of:=([.H8]-[.H7])/[.$H$5] ->  | K8: of:=([.I8]-[.I7])/[.$I$5] -> -0.0769230769230769
B9: 4 | C9: 1 | D9: of:=ROUND([.D8]*1.1;0) ->  | E9: of:=[.E8]*1.1 -> 6.75738461538462 | F9: of:=[.C9]*(60/(([.H9]*([.C9]-1))/10)) ->  | G9: of:=[.C9]*(60/((([.C9]-1)*[.I9]+[.I9])/10)) -> 6.74157303370787 | I9: 89 | J9: of:=([.H9]-[.H8])/[.$H$5] ->  | K9: of:=([.I9]-[.I8])/[.$I$5] -> -0.0692307692307692
B10: 5 | C10: 1 | D10: of:=ROUND([.D9]*1.1;0) ->  | E10: of:=[.E9]*1.1 -> 7.43312307692308 | F10: of:=[.C10]*(60/(([.H10]*([.C10]-1))/10)) ->  | G10: of:=[.C10]*(60/((([.C10]-1)*[.I10]+[.I10])/10)) -> 7.40740740740741 | I10: 81 | J10: of:=([.H10]-[.H9])/[.$H$5] ->  | K10: of:=([.I10]-[.I9])/[.$I$5] -> -0.0615384615384615
B11: 6 | C11: 1 | D11: of:=ROUND([.D10]*1.1;0) ->  | E11: of:=[.E10]*1.1 -> 8.17643538461539 | F11: of:=[.C11]*(60/(([.H11]*([.C11]-1))/10)) ->  | G11: of:=[.C11]*(60/((([.C11]-1)*[.I11]+[.I11])/10)) -> 8.21917808219178 | I11: 73 | J11: of:=([.H11]-[.H10])/[.$H$5] ->  | K11: of:=([.I11]-[.I10])/[.$I$5] -> -0.0615384615384615
B12: 7 | C12: 1 | D12: of:=ROUND([.D11]*1.1;0) ->  | E12: of:=[.E11]*1.1 -> 8.99407892307693 | F12: of:=[.C12]*(60/(([.H12]*([.C12]-1))/10)) ->  | G12: of:=[.C12]*(60/((([.C12]-1)*[.I12]+[.I12])/10)) -> 9.09090909090909 | I12: 66 | J12: of:=([.H12]-[.H11])/[.$H$5] ->  | K12: of:=([.I12]-[.I11])/[.$I$5] -> -0.0538461538461539

Sheet: Flamethrower
B2: ROF-Einheit: Schüsse pro Minute
D3: Soll | F3: Ist | H3: Zeile 0: absolut in 0,1 s, danach Abzüge in % | L3: Veränderungen in Upgrades immer in % des Ausgangswertes!!!!
B4: Update (0 = no update) | C4: numRounds | D4: Salvo | E4: Cycle | F4: Salvo | G4: Cycle | H4: firePause | I4: reloadTime | J4: firePauseΔ | K4: reloadTimeΔ
B5: 0 | C5: 3 | D5: of:=[.C5]*(60/(([.H5]*([.C5]-1))/10)) -> 900 | E5: of:=[.C5]*(60/((([.C5]-1)*[.I5]+[.I5])/10)) -> 15 | F5: of:=[.D5] -> 900 | G5: of:=[.E5] -> 15 | H5: 1 | I5: 40
B6: 1 | C6: 3 | D6: of:=ROUND([.D5]*1.1;0) -> 990 | E6: of:=[.E5]*1.1 -> 16.5 | F6: of:=[.C6]*(60/(([.H6]*([.C6]-1))/10)) -> 989.010989010989 | G6: of:=[.C6]*(60/((([.C6]-1)*[.I6]+[.I6])/10)) -> 16.2162162162162 | H6: 0.91 | I6: 37 | J6: of:=([.H6]-[.H5])/[.$H$5] -> -0.09 | K6: of:=([.I6]-[.I5])/[.$I$5] -> -0.075
B7: 2 | C7: 3 | D7: of:=ROUND([.D6]*1.1;0) -> 1089 | E7: of:=[.E6]*1.1 -> 18.15 | F7: of:=[.C7]*(60/(([.H7]*([.C7]-1))/10)) -> 1084.33734939759 | G7: of:=[.C7]*(60/((([.C7]-1)*[.I7]+[.I7])/10)) -> 18.1818181818182 | H7: 0.83 | I7: 33 | J7: of:=([.H7]-[.H6])/[.$H$5] -> -0.08 | K7: of:=([.I7]-[.I6])/[.$I$5] -> -0.1
B8: 3 | C8: 3 | D8: of:=ROUND([.D7]*1.1;0) -> 1198 | E8: of:=[.E7]*1.1 -> 19.965 | F8: of:=[.C8]*(60/(([.H8]*([.C8]-1))/10)) -> 1200 | G8: of:=[.C8]*(60/((([.C8]-1)*[.I8]+[.I8])/10)) -> 20 | H8: 0.75 | I8: 30 | J8: of:=([.H8]-[.H7])/[.$H$5] -> -0.0800000000000001 | K8: of:=([.I8]-[.I7])/[.$I$5] -> -0.075
B9: 4 | C9: 3 | D9: of:=ROUND([.D8]*1.1;0) -> 1318 | E9: of:=[.E8]*1.1 -> 21.9615 | F9: of:=[.C9]*(60/(([.H9]*([.C9]-1))/10)) -> 1323.52941176471 | G9: of:=[.C9]*(60/((([.C9]-1)*[.I9]+[.I9])/10)) -> 21.4285714285714 | H9: 0.68 | I9: 28 | J9: of:=([.H9]-[.H8])/[.$H$5] -> -0.07 | K9: of:=([.I9]-[.I8])/[.$I$5] -> -0.05
B10: 5 | C10: 3 | D10: of:=ROUND([.D9]*1.1;0) -> 1450 | E10: of:=[.E9]*1.1 -> 24.15765 | F10: of:=[.C10]*(60/(([.H10]*([.C10]-1))/10)) -> 1451.61290322581 | G10: of:=[.C10]*(60/((([.C10]-1)*[.I10]+[.I10])/10)) -> 24 | H10: 0.62 | I10: 25 | J10: of:=([.H10]-[.H9])/[.$H$5] -> -0.0600000000000001 | K10: of:=([.I10]-[.I9])/[.$I$5] -> -0.075
B11: 6 | C11: 3 | D11: of:=ROUND([.D10]*1.1;0) -> 1595 | E11: of:=[.E10]*1.1 -> 26.573415 | F11: of:=[.C11]*(60/(([.H11]*([.C11]-1))/10)) -> 1578.94736842105 | G11: of:=[.C11]*(60/((([.C11]-1)*[.I11]+[.I11])/10)) -> 26.0869565217391 | H11: 0.57 | I11: 23 | J11: of:=([.H11]-[.H10])/[.$H$5] -> -0.0499999999999999 | K11: of:=([.I11]-[.I10])/[.$I$5] -> -0.05
B12: 7 | C12: 3 | D12: of:=ROUND([.D11]*1.1;0) -> 1755 | E12: of:=[.E11]*1.1 -> 29.2307565 | F12: of:=[.C12]*(60/(([.H12]*([.C12]-1))/10)) -> 1764.70588235294 | G12: of:=[.C12]*(60/((([.C12]-1)*[.I12]+[.I12])/10)) -> 28.5714285714286 | H12: 0.51 | I12: 21 | J12: of:=([.H12]-[.H11])/[.$H$5] -> -0.0600000000000001 | K12: of:=([.I12]-[.I11])/[.$I$5] -> -0.05

Sheet: GrenadeLauncher-Cyborg
B2: ROF-Einheit: Schüsse pro Minute
D3: Soll | F3: Ist | H3: Zeile 0: absolut in 0,1 s, danach Abzüge in % | L3: Veränderungen in Upgrades immer in % des Ausgangswertes!!!!
B4: Update (0 = no update) | C4: numRounds | D4: Salvo | E4: Cycle | F4: Salvo | G4: Cycle | H4: firePause | I4: reloadTime | J4: firePauseΔ | K4: reloadTimeΔ
B5: 0 | C5: 1 | D5: of:=[.C5]*(60/(([.H5]*([.C5]-1))/10)) ->  | E5: of:=[.C5]*(60/((([.C5]-1)*[.I5]+[.I5])/10)) -> 4 | F5: of:=[.D5] ->  | G5: of:=[.E5] -> 4 | I5: 150
B6: 1 | C6: 1 | D6: of:=ROUND([.D5]*1.1;0) ->  | E6: of:=[.E5]*1.1 -> 4.4 | F6: of:=[.C6]*(60/(([.H6]*([.C6]-1))/10)) ->  | G6: of:=[.C6]*(60/((([.C6]-1)*[.I6]+[.I6])/10)) -> 4.41176470588235 | I6: 136 | J6: of:=([.H6]-[.H5])/[.$H$5] ->  | K6: of:=([.I6]-[.I5])/[.$I$5] -> -0.0933333333333333
B7: 2 | C7: 1 | D7: of:=ROUND([.D6]*1.1;0) ->  | E7: of:=[.E6]*1.1 -> 4.84 | F7: of:=[.C7]*(60/(([.H7]*([.C7]-1))/10)) ->  | G7: of:=[.C7]*(60/((([.C7]-1)*[.I7]+[.I7])/10)) -> 4.83870967741936 | I7: 124 | J7: of:=([.H7]-[.H6])/[.$H$5] ->  | K7: of:=([.I7]-[.I6])/[.$I$5] -> -0.08
B8: 3 | C8: 1 | D8: of:=ROUND([.D7]*1.1;0) ->  | E8: of:=[.E7]*1.1 -> 5.324 | F8: of:=[.C8]*(60/(([.H8]*([.C8]-1))/10)) ->  | G8: of:=[.C8]*(60/((([.C8]-1)*[.I8]+[.I8])/10)) -> 5.30973451327434 | I8: 113 | J8: of:=([.H8]-[.H7])/[.$H$5] ->  | K8: of:=([.I8]-[.I7])/[.$I$5] -> -0.0733333333333333
B9: 4 | C9: 1 | D9: of:=ROUND([.D8]*1.1;0) ->  | E9: of:=[.E8]*1.1 -> 5.8564 | F9: of:=[.C9]*(60/(([.H9]*([.C9]-1))/10)) ->  | G9: of:=[.C9]*(60/((([.C9]-1)*[.I9]+[.I9])/10)) -> 5.88235294117647 | I9: 102 | J9: of:=([.H9]-[.H8])/[.$H$5] ->  | K9: of:=([.I9]-[.I8])/[.$I$5] -> -0.0733333333333333
B10: 5 | C10: 1 | D10: of:=ROUND([.D9]*1.1;0) ->  | E10: of:=[.E9]*1.1 -> 6.44204 | F10: of:=[.C10]*(60/(([.H10]*([.C10]-1))/10)) ->  | G10: of:=[.C10]*(60/((([.C10]-1)*[.I10]+[.I10])/10)) -> 6.45161290322581 | I10: 93 | J10: of:=([.H10]-[.H9])/[.$H$5] ->  | K10: of:=([.I10]-[.I9])/[.$I$5] -> -0.06
B11: 6 | C11: 1 | D11: of:=ROUND([.D10]*1.1;0) ->  | E11: of:=[.E10]*1.1 -> 7.086244 | F11: of:=[.C11]*(60/(([.H11]*([.C11]-1))/10)) ->  | G11: of:=[.C11]*(60/((([.C11]-1)*[.I11]+[.I11])/10)) -> 7.05882352941176 | I11: 85 | J11: of:=([.H11]-[.H10])/[.$H$5] ->  | K11: of:=([.I11]-[.I10])/[.$I$5] -> -0.0533333333333333
B12: 7 | C12: 1 | D12: of:=ROUND([.D11]*1.1;0) ->  | E12: of:=[.E11]*1.1 -> 7.79486840000001 | F12: of:=[.C12]*(60/(([.H12]*([.C12]-1))/10)) ->  | G12: of:=[.C12]*(60/((([.C12]-1)*[.I12]+[.I12])/10)) -> 7.79220779220779 | I12: 77 | J12: of:=([.H12]-[.H11])/[.$H$5] ->  | K12: of:=([.I12]-[.I11])/[.$I$5] -> -0.0533333333333333

Sheet: Howitzer
B2: ROF-Einheit: Schüsse pro Minute
D3: Soll | F3: Ist | H3: Zeile 0: absolut in 0,1 s, danach Abzüge in % | L3: Veränderungen in Upgrades immer in % des Ausgangswertes!!!!
B4: Update (0 = no update) | C4: numRounds | D4: Salvo | E4: Cycle | F4: Salvo | G4: Cycle | H4: firePause | I4: reloadTime | J4: firePauseΔ | K4: reloadTimeΔ
B5: 0 | C5: 1 | D5: of:=[.C5]*(60/(([.H5]*([.C5]-1))/10)) ->  | E5: of:=[.C5]*(60/((([.C5]-1)*[.I5]+[.I5])/10)) -> 3 | F5: of:=[.D5] ->  | G5: of:=[.E5] -> 3 | I5: 200
B6: 1 | C6: 1 | D6: of:=ROUND([.D5]*1.1;0) ->  | E6: of:=[.E5]*1.1 -> 3.3 | F6: of:=[.C6]*(60/(([.H6]*([.C6]-1))/10)) ->  | G6: of:=[.C6]*(60/((([.C6]-1)*[.I6]+[.I6])/10)) -> 3.31491712707182 | I6: 181 | J6: of:=([.H6]-[.H5])/[.$H$5] ->  | K6: of:=([.I6]-[.I5])/[.$I$5] -> -0.095
B7: 2 | C7: 1 | D7: of:=ROUND([.D6]*1.1;0) ->  | E7: of:=[.E6]*1.1 -> 3.63 | F7: of:=[.C7]*(60/(([.H7]*([.C7]-1))/10)) ->  | G7: of:=[.C7]*(60/((([.C7]-1)*[.I7]+[.I7])/10)) -> 3.63636363636364 | I7: 165 | J7: of:=([.H7]-[.H6])/[.$H$5] ->  | K7: of:=([.I7]-[.I6])/[.$I$5] -> -0.08
B8: 3 | C8: 1 | D8: of:=ROUND([.D7]*1.1;0) ->  | E8: of:=[.E7]*1.1 -> 3.993 | F8: of:=[.C8]*(60/(([.H8]*([.C8]-1))/10)) ->  | G8: of:=[.C8]*(60/((([.C8]-1)*[.I8]+[.I8])/10)) -> 3.97350993377483 | I8: 151 | J8: of:=([.H8]-[.H7])/[.$H$5] ->  | K8: of:=([.I8]-[.I7])/[.$I$5] -> -0.07
B9: 4 | C9: 1 | D9: of:=ROUND([.D8]*1.1;0) ->  | E9: of:=[.E8]*1.1 -> 4.3923 | F9: of:=[.C9]*(60/(([.H9]*([.C9]-1))/10)) ->  | G9: of:=[.C9]*(60/((([.C9]-1)*[.I9]+[.I9])/10)) -> 4.37956204379562 | I9: 137 | J9: of:=([.H9]-[.H8])/[.$H$5] ->  | K9: of:=([.I9]-[.I8])/[.$I$5] -> -0.07
B10: 5 | C10: 1 | D10: of:=ROUND([.D9]*1.1;0) ->  | E10: of:=[.E9]*1.1 -> 4.83153 | F10: of:=[.C10]*(60/(([.H10]*([.C10]-1))/10)) ->  | G10: of:=[.C10]*(60/((([.C10]-1)*[.I10]+[.I10])/10)) -> 4.83870967741936 | I10: 124 | J10: of:=([.H10]-[.H9])/[.$H$5] ->  | K10: of:=([.I10]-[.I9])/[.$I$5] -> -0.065
B11: 6 | C11: 1 | D11: of:=ROUND([.D10]*1.1;0) ->  | E11: of:=[.E10]*1.1 -> 5.314683 | F11: of:=[.C11]*(60/(([.H11]*([.C11]-1))/10)) ->  | G11: of:=[.C11]*(60/((([.C11]-1)*[.I11]+[.I11])/10)) -> 5.30973451327434 | I11: 113 | J11: of:=([.H11]-[.H10])/[.$H$5] ->  | K11: of:=([.I11]-[.I10])/[.$I$5] -> -0.055
B12: 7 | C12: 1 | D12: of:=ROUND([.D11]*1.1;0) ->  | E12: of:=[.E11]*1.1 -> 5.8461513 | F12: of:=[.C12]*(60/(([.H12]*([.C12]-1))/10)) ->  | G12: of:=[.C12]*(60/((([.C12]-1)*[.I12]+[.I12])/10)) -> 5.8252427184466 | I12: 103 | J12: of:=([.H12]-[.H11])/[.$H$5] ->  | K12: of:=([.I12]-[.I11])/[.$I$5] -> -0.05

Sheet: HowitzerIncendiary
B2: ROF-Einheit: Schüsse pro Minute
D3: Soll | F3: Ist | H3: Zeile 0: absolut in 0,1 s, danach Abzüge in % | L3: Veränderungen in Upgrades immer in % des Ausgangswertes!!!!
B4: Update (0 = no update) | C4: numRounds | D4: Salvo | E4: Cycle | F4: Salvo | G4: Cycle | H4: firePause | I4: reloadTime | J4: firePauseΔ | K4: reloadTimeΔ
B5: 0 | C5: 1 | D5: of:=[.C5]*(60/(([.H5]*([.C5]-1))/10)) ->  | E5: of:=[.C5]*(60/((([.C5]-1)*[.I5]+[.I5])/10)) -> 3 | F5: of:=[.D5] ->  | G5: of:=[.E5] -> 3 | I5: 200
B6: 1 | C6: 1 | D6: of:=ROUND([.D5]*1.1;0) ->  | E6: of:=[.E5]*1.1 -> 3.3 | F6: of:=[.C6]*(60/(([.H6]*([.C6]-1))/10)) ->  | G6: of:=[.C6]*(60/((([.C6]-1)*[.I6]+[.I6])/10)) -> 3.31491712707182 | I6: 181 | J6: of:=([.H6]-[.H5])/[.$H$5] ->  | K6: of:=([.I6]-[.I5])/[.$I$5] -> -0.095
B7: 2 | C7: 1 | D7: of:=ROUND([.D6]*1.1;0) ->  | E7: of:=[.E6]*1.1 -> 3.63 | F7: of:=[.C7]*(60/(([.H7]*([.C7]-1))/10)) ->  | G7: of:=[.C7]*(60/((([.C7]-1)*[.I7]+[.I7])/10)) -> 3.63636363636364 | I7: 165 | J7: of:=([.H7]-[.H6])/[.$H$5] ->  | K7: of:=([.I7]-[.I6])/[.$I$5] -> -0.08
B8: 3 | C8: 1 | D8: of:=ROUND([.D7]*1.1;0) ->  | E8: of:=[.E7]*1.1 -> 3.993 | F8: of:=[.C8]*(60/(([.H8]*([.C8]-1))/10)) ->  | G8: of:=[.C8]*(60/((([.C8]-1)*[.I8]+[.I8])/10)) -> 3.97350993377483 | I8: 151 | J8: of:=([.H8]-[.H7])/[.$H$5] ->  | K8: of:=([.I8]-[.I7])/[.$I$5] -> -0.07
B9: 4 | C9: 1 | D9: of:=ROUND([.D8]*1.1;0) ->  | E9: of:=[.E8]*1.1 -> 4.3923 | F9: of:=[.C9]*(60/(([.H9]*([.C9]-1))/10)) ->  | G9: of:=[.C9]*(60/((([.C9]-1)*[.I9]+[.I9])/10)) -> 4.37956204379562 | I9: 137 | J9: of:=([.H9]-[.H8])/[.$H$5] ->  | K9: of:=([.I9]-[.I8])/[.$I$5] -> -0.07
B10: 5 | C10: 1 | D10: of:=ROUND([.D9]*1.1;0) ->  | E10: of:=[.E9]*1.1 -> 4.83153 | F10: of:=[.C10]*(60/(([.H10]*([.C10]-1))/10)) ->  | G10: of:=[.C10]*(60/((([.C10]-1)*[.I10]+[.I10])/10)) -> 4.83870967741936 | I10: 124 | J10: of:=([.H10]-[.H9])/[.$H$5] ->  | K10: of:=([.I10]-[.I9])/[.$I$5] -> -0.065
B11: 6 | C11: 1 | D11: of:=ROUND([.D10]*1.1;0) ->  | E11: of:=[.E10]*1.1 -> 5.314683 | F11: of:=[.C11]*(60/(([.H11]*([.C11]-1))/10)) ->  | G11: of:=[.C11]*(60/((([.C11]-1)*[.I11]+[.I11])/10)) -> 5.30973451327434 | I11: 113 | J11: of:=([.H11]-[.H10])/[.$H$5] ->  | K11: of:=([.I11]-[.I10])/[.$I$5] -> -0.055
B12: 7 | C12: 1 | D12: of:=ROUND([.D11]*1.1;0) ->  | E12: of:=[.E11]*1.1 -> 5.8461513 | F12: of:=[.C12]*(60/(([.H12]*([.C12]-1))/10)) ->  | G12: of:=[.C12]*(60/((([.C12]-1)*[.I12]+[.I12])/10)) -> 5.8252427184466 | I12: 103 | J12: of:=([.H12]-[.H11])/[.$H$5] ->  | K12: of:=([.I12]-[.I11])/[.$I$5] -> -0.05

Sheet: Lancer-Cyborg+Lancer-VTOL
B2: ROF-Einheit: Schüsse pro Minute
D3: Soll | F3: Ist | H3: Zeile 0: absolut in 0,1 s, danach Abzüge in % | L3: Veränderungen in Upgrades immer in % des Ausgangswertes!!!!
B4: Update (0 = no update) | C4: numRounds | D4: Salvo | E4: Cycle | F4: Salvo | G4: Cycle | H4: firePause | I4: reloadTime | J4: firePauseΔ | K4: reloadTimeΔ
B5: CYBORG (wie bei anderen Einzelschusswaffen: eigentlich firePause angegeben, aber für das Calc Sheet reloadTime eingetragen)
B6: 0 | C6: 1 | D6: of:=[.C6]*(60/(([.H6]*([.C6]-1))/10)) ->  | E6: of:=[.C6]*(60/((([.C6]-1)*[.I6]+[.I6])/10)) -> 8.57142857142857 | F6: of:=[.D6] ->  | G6: of:=[.E6] -> 8.57142857142857 | I6: 70
B7: 1 | C7: 1 | D7: of:=ROUND([.D6]*1.1;0) ->  | E7: of:=[.E6]*1.1 -> 9.42857142857143 | F7: of:=[.C7]*(60/(([.H7]*([.C7]-1))/10)) ->  | G7: of:=[.C7]*(60/((([.C7]-1)*[.I7]+[.I7])/10)) -> 9.375 | I7: 64 | J7: of:=([.H7]-[.H6])/[.$H$6] ->  | K7: of:=([.I7]-[.I6])/[.$I$6] -> -0.0857142857142857
B8: 2 | C8: 1 | D8: of:=ROUND([.D7]*1.1;0) ->  | E8: of:=[.E7]*1.1 -> 10.3714285714286 | F8: of:=[.C8]*(60/(([.H8]*([.C8]-1))/10)) ->  | G8: of:=[.C8]*(60/((([.C8]-1)*[.I8]+[.I8])/10)) -> 10.3448275862069 | I8: 58 | J8: of:=([.H8]-[.H7])/[.$H$6] ->  | K8: of:=([.I8]-[.I7])/[.$I$6] -> -0.0857142857142857
B9: 3 | C9: 1 | D9: of:=ROUND([.D8]*1.1;0) ->  | E9: of:=[.E8]*1.1 -> 11.4085714285714 | F9: of:=[.C9]*(60/(([.H9]*([.C9]-1))/10)) ->  | G9: of:=[.C9]*(60/((([.C9]-1)*[.I9]+[.I9])/10)) -> 11.3207547169811 | I9: 53 | J9: of:=([.H9]-[.H8])/[.$H$6] ->  | K9: of:=([.I9]-[.I8])/[.$I$6] -> -0.0714285714285714
B10: 4 | C10: 1 | D10: of:=ROUND([.D9]*1.1;0) ->  | E10: of:=[.E9]*1.1 -> 12.5494285714286 | F10: of:=[.C10]*(60/(([.H10]*([.C10]-1))/10)) ->  | G10: of:=[.C10]*(60/((([.C10]-1)*[.I10]+[.I10])/10)) -> 12.5 | I10: 48 | J10: of:=([.H10]-[.H9])/[.$H$6] ->  | K10: of:=([.I10]-[.I9])/[.$I$6] -> -0.0714285714285714
B11: 5 | C11: 1 | D11: of:=ROUND([.D10]*1.1;0) ->  | E11: of:=[.E10]*1.1 -> 13.8043714285714 | F11: of:=[.C11]*(60/(([.H11]*([.C11]-1))/10)) ->  | G11: of:=[.C11]*(60/((([.C11]-1)*[.I11]+[.I11])/10)) -> 13.6363636363636 | I11: 44 | J11: of:=([.H11]-[.H10])/[.$H$6] ->  | K11: of:=([.I11]-[.I10])/[.$I$6] -> -0.0571428571428571
B12: 6 | C12: 1 | D12: of:=ROUND([.D11]*1.1;0) ->  | E12: of:=[.E11]*1.1 -> 15.1848085714286 | F12: of:=[.C12]*(60/(([.H12]*([.C12]-1))/10)) ->  | G12: of:=[.C12]*(60/((([.C12]-1)*[.I12]+[.I12])/10)) -> 15 | I12: 40 | J12: of:=([.H12]-[.H11])/[.$H$6] ->  | K12: of:=([.I12]-[.I11])/[.$I$6] -> -0.0571428571428571
B13: 7 | C13: 1 | D13: of:=ROUND([.D12]*1.1;0) ->  | E13: of:=[.E12]*1.1 -> 16.7032894285714 | F13: of:=[.C13]*(60/(([.H13]*([.C13]-1))/10)) ->  | G13: of:=[.C13]*(60/((([.C13]-1)*[.I13]+[.I13])/10)) -> 16.6666666666667 | I13: 36 | J13: of:=([.H13]-[.H12])/[.$H$6] ->  | K13: of:=([.I13]-[.I12])/[.$I$6] -> -0.0571428571428571
B15: VTOL (Updates für firePause von Cyborgvariante übernommen)
B16: 0 | C16: 2 | D16: of:=[.C16]*(60/(([.H16]*([.C16]-1))/10)) -> 400 | E16: of:=[.C16]*(60/((([.C16]-1)*[.I16]+[.I16])/10)) -> 10 | F16: of:=[.D16] -> 400 | G16: of:=[.E16] -> 10 | H16: 3 | I16: 60
B17: 1 | C17: 2 | D17: of:=ROUND([.D16]*1.1;0) -> 440 | E17: of:=[.E16]*1.1 -> 11 | F17: of:=[.C17]*(60/(([.H17]*([.C17]-1))/10)) -> 437.5 | G17: of:=[.C17]*(60/((([.C17]-1)*[.I17]+[.I17])/10)) -> 10.9090909090909 | H17: of:=[.$H$16]*(1+SUM([.$K$7:.K7])) -> 2.74285714285714 | I17: 55 | J17: of:=([.H17]-[.H16])/[.$H$16] -> -0.0857142857142857 | K17: of:=([.I17]-[.I16])/[.$I$17] -> -0.0909090909090909
B18: 2 | C18: 2 | D18: of:=ROUND([.D17]*1.1;0) -> 484 | E18: of:=[.E17]*1.1 -> 12.1 | F18: of:=[.C18]*(60/(([.H18]*([.C18]-1))/10)) -> 482.758620689655 | G18: of:=[.C18]*(60/((([.C18]-1)*[.I18]+[.I18])/10)) -> 12 | H18: of:=[.$H$16]*(1+SUM([.$K$7:.K8])) -> 2.48571428571429 | I18: 50 | J18: of:=([.H18]-[.H17])/[.$H$16] -> -0.0857142857142857 | K18: of:=([.I18]-[.I17])/[.$I$17] -> -0.0909090909090909
B19: 3 | C19: 2 | D19: of:=ROUND([.D18]*1.1;0) -> 532 | E19: of:=[.E18]*1.1 -> 13.31 | F19: of:=[.C19]*(60/(([.H19]*([.C19]-1))/10)) -> 528.301886792453 | G19: of:=[.C19]*(60/((([.C19]-1)*[.I19]+[.I19])/10)) -> 13.3333333333333 | H19: of:=[.$H$16]*(1+SUM([.$K$7:.K9])) -> 2.27142857142857 | I19: 45 | J19: of:=([.H19]-[.H18])/[.$H$16] -> -0.0714285714285715 | K19: of:=([.I19]-[.I18])/[.$I$17] -> -0.0909090909090909
B20: 4 | C20: 2 | D20: of:=ROUND([.D19]*1.1;0) -> 585 | E20: of:=[.E19]*1.1 -> 14.641 | F20: of:=[.C20]*(60/(([.H20]*([.C20]-1))/10)) -> 583.333333333333 | G20: of:=[.C20]*(60/((([.C20]-1)*[.I20]+[.I20])/10)) -> 14.6341463414634 | H20: of:=[.$H$16]*(1+SUM([.$K$7:.K10])) -> 2.05714285714286 | I20: 41 | J20: of:=([.H20]-[.H19])/[.$H$16] -> -0.0714285714285715 | K20: of:=([.I20]-[.I19])/[.$I$17] -> -0.0727272727272727
B21: 5 | C21: 2 | D21: of:=ROUND([.D20]*1.1;0) -> 644 | E21: of:=[.E20]*1.1 -> 16.1051 | F21: of:=[.C21]*(60/(([.H21]*([.C21]-1))/10)) -> 636.363636363636 | G21: of:=[.C21]*(60/((([.C21]-1)*[.I21]+[.I21])/10)) -> 16.2162162162162 | H21: of:=[.$H$16]*(1+SUM([.$K$7:.K11])) -> 1.88571428571429 | I21: 37 | J21: of:=([.H21]-[.H20])/[.$H$16] -> -0.0571428571428571 | K21: of:=([.I21]-[.I20])/[.$I$17] -> -0.0727272727272727
B22: 6 | C22: 2 | D22: of:=ROUND([.D21]*1.1;0) -> 708 | E22: of:=[.E21]*1.1 -> 17.71561 | F22: of:=[.C22]*(60/(([.H22]*([.C22]-1))/10)) -> 700 | G22: of:=[.C22]*(60/((([.C22]-1)*[.I22]+[.I22])/10)) -> 17.6470588235294 | H22: of:=[.$H$16]*(1+SUM([.$K$7:.K12])) -> 1.71428571428571 | I22: 34 | J22: of:=([.H22]-[.H21])/[.$H$16] -> -0.0571428571428572 | K22: of:=([.I22]-[.I21])/[.$I$17] -> -0.0545454545454545
B23: 7 | C23: 2 | D23: of:=ROUND([.D22]*1.1;0) -> 779 | E23: of:=[.E22]*1.1 -> 19.487171 | F23: of:=[.C23]*(60/(([.H23]*([.C23]-1))/10)) -> 777.777777777778 | G23: of:=[.C23]*(60/((([.C23]-1)*[.I23]+[.I23])/10)) -> 19.3548387096774 | H23: of:=[.$H$16]*(1+SUM([.$K$7:.K13])) -> 1.54285714285714 | I23: 31 | J23: of:=([.H23]-[.H22])/[.$H$16] -> -0.0571428571428572 | K23: of:=([.I23]-[.I22])/[.$I$17] -> -0.0545454545454545

Sheet: Laser
B2: ROF-Einheit: Schüsse pro Minute
D3: Soll | F3: Ist | H3: Zeile 0: absolut in 0,1 s, danach Abzüge in % | L3: Veränderungen in Upgrades immer in % des Ausgangswertes!!!!
B4: Update (0 = no update) | C4: numRounds | D4: Salvo | E4: Cycle | F4: Salvo | G4: Cycle | H4: firePause | I4: reloadTime | J4: firePauseΔ | K4: reloadTimeΔ
B5: 0 | C5: 1 | D5: of:=[.C5]*(60/(([.H5]*([.C5]-1))/10)) ->  | E5: of:=[.C5]*(60/((([.C5]-1)*[.I5]+[.I5])/10)) -> 6 | F5: of:=[.D5] ->  | G5: of:=[.E5] -> 6 | I5: 100
B6: 1 | C6: 1 | D6: of:=ROUND([.D5]*1.1;0) ->  | E6: of:=[.E5]*1.1 -> 6.6 | F6: of:=[.C6]*(60/(([.H6]*([.C6]-1))/10)) ->  | G6: of:=[.C6]*(60/((([.C6]-1)*[.I6]+[.I6])/10)) -> 6.59340659340659 | I6: 91 | J6: of:=([.H6]-[.H5])/[.$H$5] ->  | K6: of:=([.I6]-[.I5])/[.$I$5] -> -0.09
B7: 2 | C7: 1 | D7: of:=ROUND([.D6]*1.1;0) ->  | E7: of:=[.E6]*1.1 -> 7.26 | F7: of:=[.C7]*(60/(([.H7]*([.C7]-1))/10)) ->  | G7: of:=[.C7]*(60/((([.C7]-1)*[.I7]+[.I7])/10)) -> 7.2289156626506 | I7: 83 | J7: of:=([.H7]-[.H6])/[.$H$5] ->  | K7: of:=([.I7]-[.I6])/[.$I$5] -> -0.08
B8: 3 | C8: 1 | D8: of:=ROUND([.D7]*1.1;0) ->  | E8: of:=[.E7]*1.1 -> 7.986 | F8: of:=[.C8]*(60/(([.H8]*([.C8]-1))/10)) ->  | G8: of:=[.C8]*(60/((([.C8]-1)*[.I8]+[.I8])/10)) -> 8 | I8: 75 | J8: of:=([.H8]-[.H7])/[.$H$5] ->  | K8: of:=([.I8]-[.I7])/[.$I$5] -> -0.08
B9: 4 | C9: 1 | D9: of:=ROUND([.D8]*1.1;0) ->  | E9: of:=[.E8]*1.1 -> 8.7846 | F9: of:=[.C9]*(60/(([.H9]*([.C9]-1))/10)) ->  | G9: of:=[.C9]*(60/((([.C9]-1)*[.I9]+[.I9])/10)) -> 8.82352941176471 | I9: 68 | J9: of:=([.H9]-[.H8])/[.$H$5] ->  | K9: of:=([.I9]-[.I8])/[.$I$5] -> -0.07
B10: 5 | C10: 1 | D10: of:=ROUND([.D9]*1.1;0) ->  | E10: of:=[.E9]*1.1 -> 9.66306 | F10: of:=[.C10]*(60/(([.H10]*([.C10]-1))/10)) ->  | G10: of:=[.C10]*(60/((([.C10]-1)*[.I10]+[.I10])/10)) -> 9.67741935483871 | I10: 62 | J10: of:=([.H10]-[.H9])/[.$H$5] ->  | K10: of:=([.I10]-[.I9])/[.$I$5] -> -0.06
B11: 6 | C11: 1 | D11: of:=ROUND([.D10]*1.1;0) ->  | E11: of:=[.E10]*1.1 -> 10.629366 | F11: of:=[.C11]*(60/(([.H11]*([.C11]-1))/10)) ->  | G11: of:=[.C11]*(60/((([.C11]-1)*[.I11]+[.I11])/10)) -> 10.7142857142857 | I11: 56 | J11: of:=([.H11]-[.H10])/[.$H$5] ->  | K11: of:=([.I11]-[.I10])/[.$I$5] -> -0.06
B12: 7 | C12: 1 | D12: of:=ROUND([.D11]*1.1;0) ->  | E12: of:=[.E11]*1.1 -> 11.6923026 | F12: of:=[.C12]*(60/(([.H12]*([.C12]-1))/10)) ->  | G12: of:=[.C12]*(60/((([.C12]-1)*[.I12]+[.I12])/10)) -> 11.7647058823529 | I12: 51 | J12: of:=([.H12]-[.H11])/[.$H$5] ->  | K12: of:=([.I12]-[.I11])/[.$I$5] -> -0.05

Sheet: Machinegun-Cyborg
B2: ROF-Einheit: Schüsse pro Minute
D3: Soll | F3: Ist | H3: Zeile 0: absolut in 0,1 s, danach Abzüge in % | L3: Veränderungen in Upgrades immer in % des Ausgangswertes!!!!
B4: Update (0 = no update) | C4: numRounds | D4: Salvo | E4: Cycle | F4: Salvo | G4: Cycle | H4: firePause | I4: reloadTime | J4: firePauseΔ | K4: reloadTimeΔ
B5: 0 | C5: 1 | D5: of:=[.C5]*(60/(([.H5]*([.C5]-1))/10)) ->  | E5: of:=[.C5]*(60/((([.C5]-1)*[.I5]+[.I5])/10)) -> 40 | F5: of:=[.D5] ->  | G5: of:=[.E5] -> 40 | I5: 15
B6: 1 | C6: 1 | D6: of:=ROUND([.D5]*1.1;0) ->  | E6: of:=[.E5]*1.1 -> 44 | F6: of:=[.C6]*(60/(([.H6]*([.C6]-1))/10)) ->  | G6: of:=[.C6]*(60/((([.C6]-1)*[.I6]+[.I6])/10)) -> 43.7956204379562 | I6: 13.7 | J6: of:=([.H6]-[.H5])/[.$H$5] ->  | K6: of:=([.I6]-[.I5])/[.$I$5] -> -0.0866666666666667
B7: 2 | C7: 1 | D7: of:=ROUND([.D6]*1.1;0) ->  | E7: of:=[.E6]*1.1 -> 48.4 | F7: of:=[.C7]*(60/(([.H7]*([.C7]-1))/10)) ->  | G7: of:=[.C7]*(60/((([.C7]-1)*[.I7]+[.I7])/10)) -> 48.3870967741936 | I7: 12.4 | J7: of:=([.H7]-[.H6])/[.$H$5] ->  | K7: of:=([.I7]-[.I6])/[.$I$5] -> -0.0866666666666666
B8: 3 | C8: 1 | D8: of:=ROUND([.D7]*1.1;0) ->  | E8: of:=[.E7]*1.1 -> 53.24 | F8: of:=[.C8]*(60/(([.H8]*([.C8]-1))/10)) ->  | G8: of:=[.C8]*(60/((([.C8]-1)*[.I8]+[.I8])/10)) -> 53.0973451327434 | I8: 11.3 | J8: of:=([.H8]-[.H7])/[.$H$5] ->  | K8: of:=([.I8]-[.I7])/[.$I$5] -> -0.0733333333333333
B9: 4 | C9: 1 | D9: of:=ROUND([.D8]*1.1;0) ->  | E9: of:=[.E8]*1.1 -> 58.564 | F9: of:=[.C9]*(60/(([.H9]*([.C9]-1))/10)) ->  | G9: of:=[.C9]*(60/((([.C9]-1)*[.I9]+[.I9])/10)) -> 58.252427184466 | I9: 10.3 | J9: of:=([.H9]-[.H8])/[.$H$5] ->  | K9: of:=([.I9]-[.I8])/[.$I$5] -> -0.0666666666666667
B10: 5 | C10: 1 | D10: of:=ROUND([.D9]*1.1;0) ->  | E10: of:=[.E9]*1.1 -> 64.4204 | F10: of:=[.C10]*(60/(([.H10]*([.C10]-1))/10)) ->  | G10: of:=[.C10]*(60/((([.C10]-1)*[.I10]+[.I10])/10)) -> 64.5161290322581 | I10: 9.3 | J10: of:=([.H10]-[.H9])/[.$H$5] ->  | K10: of:=([.I10]-[.I9])/[.$I$5] -> -0.0666666666666667
B11: 6 | C11: 1 | D11: of:=ROUND([.D10]*1.1;0) ->  | E11: of:=[.E10]*1.1 -> 70.86244 | F11: of:=[.C11]*(60/(([.H11]*([.C11]-1))/10)) ->  | G11: of:=[.C11]*(60/((([.C11]-1)*[.I11]+[.I11])/10)) -> 70.5882352941177 | I11: 8.5 | J11: of:=([.H11]-[.H10])/[.$H$5] ->  | K11: of:=([.I11]-[.I10])/[.$I$5] -> -0.0533333333333334
B12: 7 | C12: 1 | D12: of:=ROUND([.D11]*1.1;0) ->  | E12: of:=[.E11]*1.1 -> 77.948684 | F12: of:=[.C12]*(60/(([.H12]*([.C12]-1))/10)) ->  | G12: of:=[.C12]*(60/((([.C12]-1)*[.I12]+[.I12])/10)) -> 77.9220779220779 | I12: 7.7 | J12: of:=([.H12]-[.H11])/[.$H$5] ->  | K12: of:=([.I12]-[.I11])/[.$I$5] -> -0.0533333333333333

Sheet: Railgun
B2: ROF-Einheit: Schüsse pro Minute
D3: Soll | F3: Ist | H3: Zeile 0: absolut in 0,1 s, danach Abzüge in % | L3: Veränderungen in Upgrades immer in % des Ausgangswertes!!!!
B4: Update (0 = no update) | C4: numRounds | D4: Salvo | E4: Cycle | F4: Salvo | G4: Cycle | H4: firePause | I4: reloadTime | J4: firePauseΔ | K4: reloadTimeΔ
B5: 0 | C5: 1 | D5: of:=[.C5]*(60/(([.H5]*([.C5]-1))/10)) ->  | E5: of:=[.C5]*(60/((([.C5]-1)*[.I5]+[.I5])/10)) -> 4 | F5: of:=[.D5] ->  | G5: of:=[.E5] -> 4 | I5: 150
B6: 1 | C6: 1 | D6: of:=ROUND([.D5]*1.1;0) ->  | E6: of:=[.E5]*1.1 -> 4.4 | F6: of:=[.C6]*(60/(([.H6]*([.C6]-1))/10)) ->  | G6: of:=[.C6]*(60/((([.C6]-1)*[.I6]+[.I6])/10)) -> 4.41176470588235 | I6: 136 | J6: of:=([.H6]-[.H5])/[.$H$5] ->  | K6: of:=([.I6]-[.I5])/[.$I$5] -> -0.0933333333333333
B7: 2 | C7: 1 | D7: of:=ROUND([.D6]*1.1;0) ->  | E7: of:=[.E6]*1.1 -> 4.84 | F7: of:=[.C7]*(60/(([.H7]*([.C7]-1))/10)) ->  | G7: of:=[.C7]*(60/((([.C7]-1)*[.I7]+[.I7])/10)) -> 4.83870967741936 | I7: 124 | J7: of:=([.H7]-[.H6])/[.$H$5] ->  | K7: of:=([.I7]-[.I6])/[.$I$5] -> -0.08
B8: 3 | C8: 1 | D8: of:=ROUND([.D7]*1.1;0) ->  | E8: of:=[.E7]*1.1 -> 5.324 | F8: of:=[.C8]*(60/(([.H8]*([.C8]-1))/10)) ->  | G8: of:=[.C8]*(60/((([.C8]-1)*[.I8]+[.I8])/10)) -> 5.30973451327434 | I8: 113 | J8: of:=([.H8]-[.H7])/[.$H$5] ->  | K8: of:=([.I8]-[.I7])/[.$I$5] -> -0.0733333333333333
B9: 4 | C9: 1 | D9: of:=ROUND([.D8]*1.1;0) ->  | E9: of:=[.E8]*1.1 -> 5.8564 | F9: of:=[.C9]*(60/(([.H9]*([.C9]-1))/10)) ->  | G9: of:=[.C9]*(60/((([.C9]-1)*[.I9]+[.I9])/10)) -> 5.88235294117647 | I9: 102 | J9: of:=([.H9]-[.H8])/[.$H$5] ->  | K9: of:=([.I9]-[.I8])/[.$I$5] -> -0.0733333333333333
B10: 5 | C10: 1 | D10: of:=ROUND([.D9]*1.1;0) ->  | E10: of:=[.E9]*1.1 -> 6.44204 | F10: of:=[.C10]*(60/(([.H10]*([.C10]-1))/10)) ->  | G10: of:=[.C10]*(60/((([.C10]-1)*[.I10]+[.I10])/10)) -> 6.45161290322581 | I10: 93 | J10: of:=([.H10]-[.H9])/[.$H$5] ->  | K10: of:=([.I10]-[.I9])/[.$I$5] -> -0.06
B11: 6 | C11: 1 | D11: of:=ROUND([.D10]*1.1;0) ->  | E11: of:=[.E10]*1.1 -> 7.086244 | F11: of:=[.C11]*(60/(([.H11]*([.C11]-1))/10)) ->  | G11: of:=[.C11]*(60/((([.C11]-1)*[.I11]+[.I11])/10)) -> 7.05882352941176 | I11: 85 | J11: of:=([.H11]-[.H10])/[.$H$5] ->  | K11: of:=([.I11]-[.I10])/[.$I$5] -> -0.0533333333333333
B12: 7 | C12: 1 | D12: of:=ROUND([.D11]*1.1;0) ->  | E12: of:=[.E11]*1.1 -> 7.79486840000001 | F12: of:=[.C12]*(60/(([.H12]*([.C12]-1))/10)) ->  | G12: of:=[.C12]*(60/((([.C12]-1)*[.I12]+[.I12])/10)) -> 7.79220779220779 | I12: 77 | J12: of:=([.H12]-[.H11])/[.$H$5] ->  | K12: of:=([.I12]-[.I11])/[.$I$5] -> -0.0533333333333333

Sheet: RocketBattery
B2: ROF-Einheit: Schüsse pro Minute
D3: Soll | F3: Ist | H3: Zeile 0: absolut in 0,1 s, danach Abzüge in % | L3: Veränderungen in Upgrades immer in % des Ausgangswertes!!!!
B4: Update (0 = no update) | C4: numRounds | D4: Salvo | E4: Cycle | F4: Salvo | G4: Cycle | H4: firePause | I4: reloadTime | J4: firePauseΔ | K4: reloadTimeΔ
B5: 0 | C5: 6 | D5: of:=[.C5]*(60/(([.H5]*([.C5]-1))/10)) -> 72 | E5: of:=[.C5]*(60/((([.C5]-1)*[.I5]+[.I5])/10)) -> 1 | F5: of:=[.D5] -> 72 | G5: of:=[.E5] -> 1 | H5: 10 | I5: 600
B6: 1 | C6: 6 | D6: of:=ROUND([.D5]*1.1;0) -> 79 | E6: of:=[.E5]*1.1 -> 1.1 | F6: of:=[.C6]*(60/(([.H6]*([.C6]-1))/10)) -> 79.1208791208791 | G6: of:=[.C6]*(60/((([.C6]-1)*[.I6]+[.I6])/10)) -> 1.10091743119266 | H6: 9.1 | I6: 545 | J6: of:=([.H6]-[.H5])/[.$H$5] -> -0.09 | K6: of:=([.I6]-[.I5])/[.$I$5] -> -0.0916666666666667
B7: 2 | C7: 6 | D7: of:=ROUND([.D6]*1.1;0) -> 87 | E7: of:=[.E6]*1.1 -> 1.21 | F7: of:=[.C7]*(60/(([.H7]*([.C7]-1))/10)) -> 86.7469879518072 | G7: of:=[.C7]*(60/((([.C7]-1)*[.I7]+[.I7])/10)) -> 1.21212121212121 | H7: 8.3 | I7: 495 | J7: of:=([.H7]-[.H6])/[.$H$5] -> -0.0799999999999999 | K7: of:=([.I7]-[.I6])/[.$I$5] -> -0.0833333333333333
B8: 3 | C8: 6 | D8: of:=ROUND([.D7]*1.1;0) -> 96 | E8: of:=[.E7]*1.1 -> 1.331 | F8: of:=[.C8]*(60/(([.H8]*([.C8]-1))/10)) -> 96 | G8: of:=[.C8]*(60/((([.C8]-1)*[.I8]+[.I8])/10)) -> 1.33333333333333 | H8: 7.5 | I8: 450 | J8: of:=([.H8]-[.H7])/[.$H$5] -> -0.0800000000000001 | K8: of:=([.I8]-[.I7])/[.$I$5] -> -0.075
B9: 4 | C9: 6 | D9: of:=ROUND([.D8]*1.1;0) -> 106 | E9: of:=[.E8]*1.1 -> 1.4641 | F9: of:=[.C9]*(60/(([.H9]*([.C9]-1))/10)) -> 105.882352941176 | G9: of:=[.C9]*(60/((([.C9]-1)*[.I9]+[.I9])/10)) -> 1.44578313253012 | H9: 6.8 | I9: 415 | J9: of:=([.H9]-[.H8])/[.$H$5] -> -0.07 | K9: of:=([.I9]-[.I8])/[.$I$5] -> -0.0583333333333333
B10: 5 | C10: 6 | D10: of:=ROUND([.D9]*1.1;0) -> 117 | E10: of:=[.E9]*1.1 -> 1.61051 | F10: of:=[.C10]*(60/(([.H10]*([.C10]-1))/10)) -> 116.129032258065 | G10: of:=[.C10]*(60/((([.C10]-1)*[.I10]+[.I10])/10)) -> 1.6 | H10: 6.2 | I10: 375 | J10: of:=([.H10]-[.H9])/[.$H$5] -> -0.06 | K10: of:=([.I10]-[.I9])/[.$I$5] -> -0.0666666666666667
B11: 6 | C11: 6 | D11: of:=ROUND([.D10]*1.1;0) -> 129 | E11: of:=[.E10]*1.1 -> 1.771561 | F11: of:=[.C11]*(60/(([.H11]*([.C11]-1))/10)) -> 128.571428571429 | G11: of:=[.C11]*(60/((([.C11]-1)*[.I11]+[.I11])/10)) -> 1.76470588235294 | H11: 5.6 | I11: 340 | J11: of:=([.H11]-[.H10])/[.$H$5] -> -0.0600000000000001 | K11: of:=([.I11]-[.I10])/[.$I$5] -> -0.0583333333333333
B12: 7 | C12: 6 | D12: of:=ROUND([.D11]*1.1;0) -> 142 | E12: of:=[.E11]*1.1 -> 1.9487171 | F12: of:=[.C12]*(60/(([.H12]*([.C12]-1))/10)) -> 141.176470588235 | G12: of:=[.C12]*(60/((([.C12]-1)*[.I12]+[.I12])/10)) -> 1.9672131147541 | H12: 5.1 | I12: 305 | J12: of:=([.H12]-[.H11])/[.$H$5] -> -0.05 | K12: of:=([.I12]-[.I11])/[.$I$5] -> -0.0583333333333333

Sheet: ScourgeMissile
B2: ROF-Einheit: Schüsse pro Minute
D3: Soll | F3: Ist | H3: Zeile 0: absolut in 0,1 s, danach Abzüge in % | L3: Veränderungen in Upgrades immer in % des Ausgangswertes!!!!
B4: Update (0 = no update) | C4: numRounds | D4: Salvo | E4: Cycle | F4: Salvo | G4: Cycle | H4: firePause | I4: reloadTime | J4: firePauseΔ | K4: reloadTimeΔ
B5: 0 | C5: 2 | D5: of:=[.C5]*(60/(([.H5]*([.C5]-1))/10)) -> 240 | E5: of:=[.C5]*(60/((([.C5]-1)*[.I5]+[.I5])/10)) -> 5 | F5: of:=[.D5] -> 240 | G5: of:=[.E5] -> 5 | H5: 5 | I5: 120
B6: 1 | C6: 2 | D6: of:=ROUND([.D5]*1.1;0) -> 264 | E6: of:=[.E5]*1.1 -> 5.5 | F6: of:=[.C6]*(60/(([.H6]*([.C6]-1))/10)) -> 260.869565217391 | G6: of:=[.C6]*(60/((([.C6]-1)*[.I6]+[.I6])/10)) -> 5.5045871559633 | H6: 4.6 | I6: 109 | J6: of:=([.H6]-[.H5])/[.$H$5] -> -0.0800000000000001 | K6: of:=([.I6]-[.I5])/[.$I$5] -> -0.0916666666666667
B7: 2 | C7: 2 | D7: of:=ROUND([.D6]*1.1;0) -> 290 | E7: of:=[.E6]*1.1 -> 6.05 | F7: of:=[.C7]*(60/(([.H7]*([.C7]-1))/10)) -> 285.714285714286 | G7: of:=[.C7]*(60/((([.C7]-1)*[.I7]+[.I7])/10)) -> 6.06060606060606 | H7: 4.2 | I7: 99 | J7: of:=([.H7]-[.H6])/[.$H$5] -> -0.0799999999999999 | K7: of:=([.I7]-[.I6])/[.$I$5] -> -0.0833333333333333
B8: 3 | C8: 2 | D8: of:=ROUND([.D7]*1.1;0) -> 319 | E8: of:=[.E7]*1.1 -> 6.655 | F8: of:=[.C8]*(60/(([.H8]*([.C8]-1))/10)) -> 315.789473684211 | G8: of:=[.C8]*(60/((([.C8]-1)*[.I8]+[.I8])/10)) -> 6.66666666666667 | H8: 3.8 | I8: 90 | J8: of:=([.H8]-[.H7])/[.$H$5] -> -0.0800000000000001 | K8: of:=([.I8]-[.I7])/[.$I$5] -> -0.075
B9: 4 | C9: 2 | D9: of:=ROUND([.D8]*1.1;0) -> 351 | E9: of:=[.E8]*1.1 -> 7.3205 | F9: of:=[.C9]*(60/(([.H9]*([.C9]-1))/10)) -> 352.941176470588 | G9: of:=[.C9]*(60/((([.C9]-1)*[.I9]+[.I9])/10)) -> 7.31707317073171 | H9: 3.4 | I9: 82 | J9: of:=([.H9]-[.H8])/[.$H$5] -> -0.08 | K9: of:=([.I9]-[.I8])/[.$I$5] -> -0.0666666666666667
B10: 5 | C10: 2 | D10: of:=ROUND([.D9]*1.1;0) -> 386 | E10: of:=[.E9]*1.1 -> 8.05255 | F10: of:=[.C10]*(60/(([.H10]*([.C10]-1))/10)) -> 387.096774193548 | G10: of:=[.C10]*(60/((([.C10]-1)*[.I10]+[.I10])/10)) -> 8 | H10: 3.1 | I10: 75 | J10: of:=([.H10]-[.H9])/[.$H$5] -> -0.06 | K10: of:=([.I10]-[.I9])/[.$I$5] -> -0.0583333333333333
B11: 6 | C11: 2 | D11: of:=ROUND([.D10]*1.1;0) -> 425 | E11: of:=[.E10]*1.1 -> 8.857805 | F11: of:=[.C11]*(60/(([.H11]*([.C11]-1))/10)) -> 428.571428571429 | G11: of:=[.C11]*(60/((([.C11]-1)*[.I11]+[.I11])/10)) -> 8.82352941176471 | H11: 2.8 | I11: 68 | J11: of:=([.H11]-[.H10])/[.$H$5] -> -0.0600000000000001 | K11: of:=([.I11]-[.I10])/[.$I$5] -> -0.0583333333333333
B12: 7 | C12: 2 | D12: of:=ROUND([.D11]*1.1;0) -> 468 | E12: of:=[.E11]*1.1 -> 9.7435855 | F12: of:=[.C12]*(60/(([.H12]*([.C12]-1))/10)) -> 461.538461538462 | G12: of:=[.C12]*(60/((([.C12]-1)*[.I12]+[.I12])/10)) -> 9.67741935483871 | H12: 2.6 | I12: 62 | J12: of:=([.H12]-[.H11])/[.$H$5] -> -0.04 | K12: of:=([.I12]-[.I11])/[.$I$5] -> -0.05